<?xml version="1.0" encoding="UTF-8"?>
<!--
To change this license header, choose License Headers in Project Properties.
To change this template file, choose Tools | Templates
and open the template in the editor.
-->


<persona
    xmlns:xsi='http://www.w3.org/2001/XMLSchema-instance'
    xsi:noNamespaceSchemaLocation='persona.xsd'>
    <cognome>Luca</cognome>
    <nome>Verdi</nome>
    <soprannome>Luc</soprannome>
    <indirizzi>
        <indirizzo>
            <citta>Torino</citta>
            <via>Roma</via>
            <numero>124</numero>
        </indirizzo>
        <indirizzo>
            <citta>Roma</citta>
            <via>Salaria</via>
            <numero>3</numero>
        </indirizzo>
    </indirizzi>
</persona>
